{
  "version": 1,
  "id": "new-home",
  "title": "Nowy dom Kitka",
  "scenes": [
    {
      "id": "arrival",
      "title": "Przyjazd",
      "objective": "Bruno czeka na placu. Twój dom stoi przy stawie.",
      "when": []
    },
    {
      "id": "home",
      "title": "Nowy dom",
      "objective": "Na stole w domu leży koperta.",
      "when": [
        {
          "type": "flag",
          "key": "entered-home",
          "value": true
        }
      ]
    },
    {
      "id": "letter",
      "title": "List Feli",
      "objective": "Fela zaprosiła mnie do sklepu z czerwonym dachem.",
      "when": [
        {
          "type": "flag",
          "key": "read-fela-letter",
          "value": true
        }
      ]
    },
    {
      "id": "gift",
      "title": "Prezent do domu",
      "objective": "Postawię lampę od Feli przy łóżku.",
      "when": [
        {
          "type": "flag",
          "key": "lamp-received",
          "value": true
        }
      ]
    },
    {
      "id": "note",
      "title": "Zamknięta szafka",
      "objective": "Przy szafce jest kartka. Ciekawe, co na niej napisano.",
      "when": [
        {
          "type": "flag",
          "key": "lamp-placed",
          "value": true
        }
      ],
      "updates": [
        {
          "when": [
            {
              "type": "flag",
              "key": "read-cabinet-note",
              "value": true
            }
          ],
          "objective": "Bruno ma klucz do szafki. Zapytam go o niego."
        }
      ]
    },
    {
      "id": "help",
      "title": "Pomoc Brunonowi",
      "objective": "Przeniosę skrzynkę na miejsce obok grządek. Potem wrócę do Brunona.",
      "when": [
        {
          "type": "flag",
          "key": "crate-requested",
          "value": true
        }
      ],
      "updates": [
        {
          "when": [
            {
              "type": "flag",
              "key": "crate-delivered",
              "value": true
            }
          ],
          "objective": "Skrzynka stoi w ogrodzie. Wrócę do Brunona po klucz."
        }
      ]
    },
    {
      "id": "secret",
      "title": "Tajemnica szafki",
      "objective": "Otworzę szafkę w domu i sprawdzę, co jest w środku.",
      "when": [
        {
          "type": "flag",
          "key": "key-received",
          "value": true
        }
      ],
      "updates": [
        {
          "when": [
            {
              "type": "flag",
              "key": "met-tola",
              "value": true
            }
          ],
          "objective": "Miluś pomoże mi przygotować zaproszenia. Czeka przy swoim domu."
        },
        {
          "when": [
            {
              "type": "flag",
              "key": "book-found",
              "value": true
            }
          ],
          "objective": "Tola zna historię książeczki. Odwiedzę bibliotekę."
        }
      ]
    },
    {
      "id": "meeting",
      "title": "Pierwsze spotkanie",
      "objective": "Zaproszę Brunona, Felę i Tolę. Potem zadzwonię dzwonkiem w domu.",
      "when": [
        {
          "type": "flag",
          "key": "invitations-received",
          "value": true
        }
      ],
      "updates": [
        {
          "when": [
            {
              "type": "flag",
              "key": "invited-bruno",
              "value": true
            },
            {
              "type": "flag",
              "key": "invited-fela",
              "value": true
            },
            {
              "type": "flag",
              "key": "invited-tola",
              "value": true
            }
          ],
          "objective": "Wszyscy są zaproszeni. Zadzwoń dzwonkiem w domu."
        },
        {
          "when": [
            {
              "type": "flag",
              "key": "hosting",
              "value": true
            }
          ],
          "objective": "Przyjaciele są u mnie. Mogę z nimi porozmawiać."
        }
      ]
    }
  ],
  "documents": [
    {
      "id": "fela-letter",
      "title": "List od Feli",
      "lines": [
        "Cześć, Kitku! Mam coś dla ciebie.",
        "Przyjdź do sklepu. Fela."
      ]
    },
    {
      "id": "cabinet-note",
      "title": "Notatka przy szafce",
      "lines": [
        "Klucz ma Bruno. Zapytaj go o szafkę."
      ]
    },
    {
      "id": "home-book",
      "title": "Książeczka o domu",
      "lines": [
        "W tym domu spotykali się przyjaciele. Każdy przynosił opowieść.",
        "Tola zna dalszą część historii. Znajdziesz ją w bibliotece."
      ]
    },
    {
      "id": "invitation-plan",
      "title": "Lista gości",
      "lines": [
        "Zanieś zaproszenia Brunonowi, Feli i Toli.",
        "Ja też przyjdę! Gdy wrócisz do domu, zadzwoń dzwonkiem. Miluś."
      ]
    },
    {
      "id": "first-meeting",
      "title": "Mój dom jest pełen przyjaciół",
      "lines": [
        "Dziś odwiedzili mnie sąsiedzi. Rozmawialiśmy i śmialiśmy się razem.",
        "Ten dom jest już naprawdę mój. Jutro znów pójdę na spacer."
      ]
    }
  ],
  "nodes": [
    {
      "id": "bruno-welcome",
      "target": "bruno",
      "event": "interact",
      "priority": 10,
      "once": true,
      "when": [],
      "speaker": "bruno",
      "lines": [
        "Witaj, Kitku! Twój dom stoi przy stawie.",
        "Idź w prawo od placu. Dom ma niebieską tabliczkę."
      ],
      "choices": [
        {
          "id": "go",
          "label": "Rozejrzę się.",
          "effects": [
            {
              "type": "flag",
              "key": "met-bruno",
              "value": true
            }
          ]
        }
      ]
    },
    {
      "id": "bruno-chat",
      "target": "bruno",
      "event": "interact",
      "priority": 0,
      "once": false,
      "when": [],
      "speaker": "bruno",
      "lines": [
        "Miło cię widzieć, Kitku.",
        "Twój dom jest przy stawie. Wypatruj niebieskiej tabliczki."
      ],
      "choices": [
        {
          "id": "bye",
          "label": "Do zobaczenia!",
          "effects": []
        }
      ]
    },
    {
      "id": "enter-home-first",
      "target": "home-door",
      "event": "interact",
      "priority": 10,
      "once": true,
      "when": [],
      "speaker": "Kitek",
      "lines": [
        "To twój dom. Na stole czeka koperta."
      ],
      "choices": [
        {
          "id": "open",
          "label": "Otwieram drzwi.",
          "effects": [
            {
              "type": "travel",
              "location": "home",
              "x": 0,
              "z": -2.5,
              "heading": 0
            },
            {
              "type": "flag",
              "key": "entered-home",
              "value": true
            },
            {
              "type": "complete",
              "sceneId": "arrival"
            }
          ]
        }
      ]
    },
    {
      "id": "enter-home",
      "target": "home-door",
      "event": "interact",
      "priority": 0,
      "once": false,
      "when": [],
      "speaker": "Kitek",
      "lines": [
        "Wracasz do swojego domu."
      ],
      "choices": [
        {
          "id": "open",
          "label": "Wejdź do domu.",
          "effects": [
            {
              "type": "travel",
              "location": "home",
              "x": 0,
              "z": -2.5,
              "heading": 0
            }
          ]
        }
      ]
    },
    {
      "id": "exit-home",
      "target": "home-exit",
      "event": "interact",
      "priority": 0,
      "once": false,
      "when": [],
      "speaker": "Kitek",
      "lines": [
        "Wioska czeka za drzwiami."
      ],
      "choices": [
        {
          "id": "out",
          "label": "Wyjdź na spacer.",
          "effects": [
            {
              "type": "travel",
              "location": "village",
              "x": 18,
              "z": 4.2,
              "heading": 3.14159
            }
          ]
        }
      ]
    },
    {
      "id": "read-fela-letter",
      "target": "fela-letter",
      "event": "interact",
      "priority": 10,
      "once": true,
      "when": [],
      "speaker": "List od Feli",
      "lines": [
        "Cześć, Kitku! Mam coś dla ciebie.",
        "Przyjdź do sklepu. Fela."
      ],
      "choices": [
        {
          "id": "keep",
          "label": "Zachowam ten list.",
          "effects": [
            {
              "type": "flag",
              "key": "read-fela-letter",
              "value": true
            },
            {
              "type": "read",
              "documentId": "fela-letter"
            },
            {
              "type": "complete",
              "sceneId": "home"
            }
          ]
        }
      ]
    },
    {
      "id": "reread-fela-letter",
      "target": "fela-letter",
      "event": "interact",
      "priority": 0,
      "once": false,
      "when": [],
      "speaker": "List od Feli",
      "lines": [
        "Cześć, Kitku! Mam coś dla ciebie.",
        "Przyjdź do sklepu. Fela."
      ],
      "choices": [
        {
          "id": "close",
          "label": "Schowaj list.",
          "effects": []
        }
      ]
    },
    {
      "id": "read-village-sign",
      "target": "village-sign",
      "event": "interact",
      "priority": 0,
      "once": false,
      "when": [],
      "speaker": "Drogowskaz",
      "lines": [
        "Dom Kitka stoi przy stawie. Ma niebieską tabliczkę.",
        "Sklep Feli ma czerwony dach. Ogród Brunona jest za płotem."
      ],
      "choices": [
        {
          "id": "go",
          "label": "Idę dalej.",
          "effects": []
        }
      ]
    },
    {
      "id": "fela-gift",
      "target": "fela",
      "event": "interact",
      "priority": 50,
      "once": true,
      "when": [
        {
          "type": "flag",
          "key": "read-fela-letter",
          "value": true
        },
        {
          "type": "flag",